[
  {
    "id": 1,
    "oem_code": "EN900757",
    "name": "Timing belt kit",
    "category": "Engine",
    "unit_price": 415.83,
    "stock_quantity": 0
  },
  {
    "id": 2,
    "oem_code": "TY521715",
    "name": "Summer tyre",
    "category": "Tyres",
    "unit_price": 176.59,
    "stock_quantity": 35
  },
  {
    "id": 3,
    "oem_code": "BR205472",
    "name": "Brake caliper",
    "category": "Brakes",
    "unit_price": 170.23,
    "stock_quantity": 49
  },
  {
    "id": 4,
    "oem_code": "FL633055",
    "name": "Cabin filter",
    "category": "Filters",
    "unit_price": 6.21,
    "stock_quantity": 0
  },
  {
    "id": 5,
    "oem_code": "EN375417",
    "name": "Turbocharger",
    "category": "Engine",
    "unit_price": 265.31,
    "stock_quantity": 23
  },
  {
    "id": 6,
    "oem_code": "BR877676",
    "name": "Brake pad set",
    "category": "Brakes",
    "unit_price": 143.85,
    "stock_quantity": 16
  },
  {
    "id": 7,
    "oem_code": "SU106270",
    "name": "Coil spring",
    "category": "Suspension",
    "unit_price": 208.15,
    "stock_quantity": 0
  },
  {
    "id": 8,
    "oem_code": "BO117421",
    "name": "Door handle",
    "category": "Body",
    "unit_price": 124.56,
    "stock_quantity": 93
  },
  {
    "id": 9,
    "oem_code": "EL040727",
    "name": "Headlight bulb",
    "category": "Electrical",
    "unit_price": 204.04,
    "stock_quantity": 27
  },
  {
    "id": 10,
    "oem_code": "TR786813",
    "name": "Drive shaft",
    "category": "Transmission",
    "unit_price": 439.57,
    "stock_quantity": 26
  },
  {
    "id": 11,
    "oem_code": "BR370779",
    "name": "Brake disc",
    "category": "Brakes",
    "unit_price": 20.97,
    "stock_quantity": 31
  },
  {
    "id": 12,
    "oem_code": "FL189380",
    "name": "Cabin filter",
    "category": "Filters",
    "unit_price": 22.24,
    "stock_quantity": 9
  },
  {
    "id": 13,
    "oem_code": "EL896608",
    "name": "Battery",
    "category": "Electrical",
    "unit_price": 89.83,
    "stock_quantity": 116
  },
  {
    "id": 14,
    "oem_code": "BO143125",
    "name": "Windscreen wiper",
    "category": "Body",
    "unit_price": 239.26,
    "stock_quantity": 117
  },
  {
    "id": 15,
    "oem_code": "TR905767",
    "name": "Clutch kit",
    "category": "Transmission",
    "unit_price": 323.05,
    "stock_quantity": 45
  },
  {
    "id": 16,
    "oem_code": "TY720632",
    "name": "Winter tyre",
    "category": "Tyres",
    "unit_price": 163.69,
    "stock_quantity": 111
  },
  {
    "id": 17,
    "oem_code": "TR288968",
    "name": "Gearbox oil",
    "category": "Transmission",
    "unit_price": 522.29,
    "stock_quantity": 6
  },
  {
    "id": 18,
    "oem_code": "BO206880",
    "name": "Windscreen wiper",
    "category": "Body",
    "unit_price": 121.2,
    "stock_quantity": 69
  },
  {
    "id": 19,
    "oem_code": "FL744685",
    "name": "Oil filter",
    "category": "Filters",
    "unit_price": 35.41,
    "stock_quantity": 78
  },
  {
    "id": 20,
    "oem_code": "TY764812",
    "name": "Winter tyre",
    "category": "Tyres",
    "unit_price": 195.44,
    "stock_quantity": 79
  },
  {
    "id": 21,
    "oem_code": "EL015752",
    "name": "Alternator",
    "category": "Electrical",
    "unit_price": 93.83,
    "stock_quantity": 81
  },
  {
    "id": 22,
    "oem_code": "EN922230",
    "name": "Turbocharger",
    "category": "Engine",
    "unit_price": 668.61,
    "stock_quantity": 24
  },
  {
    "id": 23,
    "oem_code": "EN803737",
    "name": "Spark plug",
    "category": "Engine",
    "unit_price": 404.2,
    "stock_quantity": 51
  },
  {
    "id": 24,
    "oem_code": "EN314190",
    "name": "Water pump",
    "category": "Engine",
    "unit_price": 466.02,
    "stock_quantity": 24
  },
  {
    "id": 25,
    "oem_code": "TY126461",
    "name": "Winter tyre",
    "category": "Tyres",
    "unit_price": 139.04,
    "stock_quantity": 108
  },
  {
    "id": 26,
    "oem_code": "BR671068",
    "name": "Brake fluid",
    "category": "Brakes",
    "unit_price": 63.29,
    "stock_quantity": 36
  },
  {
    "id": 27,
    "oem_code": "BO058083",
    "name": "Door handle",
    "category": "Body",
    "unit_price": 276.62,
    "stock_quantity": 74
  },
  {
    "id": 28,
    "oem_code": "FL195140",
    "name": "Fuel filter",
    "category": "Filters",
    "unit_price": 16.48,
    "stock_quantity": 41
  },
  {
    "id": 29,
    "oem_code": "BO468057",
    "name": "Bumper",
    "category": "Body",
    "unit_price": 19.42,
    "stock_quantity": 44
  },
  {
    "id": 30,
    "oem_code": "EN252053",
    "name": "Spark plug",
    "category": "Engine",
    "unit_price": 713.03,
    "stock_quantity": 102
  },
  {
    "id": 31,
    "oem_code": "EL192229",
    "name": "Headlight bulb",
    "category": "Electrical",
    "unit_price": 44.65,
    "stock_quantity": 12
  },
  {
    "id": 32,
    "oem_code": "BR532014",
    "name": "Brake fluid",
    "category": "Brakes",
    "unit_price": 113.44,
    "stock_quantity": 90
  },
  {
    "id": 33,
    "oem_code": "TR766135",
    "name": "Gearbox oil",
    "category": "Transmission",
    "unit_price": 527.63,
    "stock_quantity": 27
  },
  {
    "id": 34,
    "oem_code": "BR023975",
    "name": "Brake disc",
    "category": "Brakes",
    "unit_price": 65.22,
    "stock_quantity": 109
  },
  {
    "id": 35,
    "oem_code": "BR035916",
    "name": "Brake fluid",
    "category": "Brakes",
    "unit_price": 179.03,
    "stock_quantity": 18
  },
  {
    "id": 36,
    "oem_code": "FL960393",
    "name": "Oil filter",
    "category": "Filters",
    "unit_price": 40.16,
    "stock_quantity": 62
  },
  {
    "id": 37,
    "oem_code": "TY084260",
    "name": "Winter tyre",
    "category": "Tyres",
    "unit_price": 178.12,
    "stock_quantity": 12
  },
  {
    "id": 38,
    "oem_code": "FL925391",
    "name": "Fuel filter",
    "category": "Filters",
    "unit_price": 6.63,
    "stock_quantity": 73
  },
  {
    "id": 39,
    "oem_code": "EL587925",
    "name": "Starter motor",
    "category": "Electrical",
    "unit_price": 13.29,
    "stock_quantity": 107
  },
  {
    "id": 40,
    "oem_code": "BR250359",
    "name": "Brake fluid",
    "category": "Brakes",
    "unit_price": 50.1,
    "stock_quantity": 110
  },
  {
    "id": 41,
    "oem_code": "SU086091",
    "name": "Control arm",
    "category": "Suspension",
    "unit_price": 195.85,
    "stock_quantity": 110
  },
  {
    "id": 42,
    "oem_code": "EL521790",
    "name": "Battery",
    "category": "Electrical",
    "unit_price": 331.87,
    "stock_quantity": 84
  },
  {
    "id": 43,
    "oem_code": "BO974308",
    "name": "Wing mirror",
    "category": "Body",
    "unit_price": 143.53,
    "stock_quantity": 65
  },
  {
    "id": 44,
    "oem_code": "EN072639",
    "name": "Spark plug",
    "category": "Engine",
    "unit_price": 604.72,
    "stock_quantity": 106
  },
  {
    "id": 45,
    "oem_code": "SU958556",
    "name": "Coil spring",
    "category": "Suspension",
    "unit_price": 56.32,
    "stock_quantity": 73
  },
  {
    "id": 46,
    "oem_code": "FL555254",
    "name": "Oil filter",
    "category": "Filters",
    "unit_price": 8.23,
    "stock_quantity": 27
  },
  {
    "id": 47,
    "oem_code": "EN550116",
    "name": "Turbocharger",
    "category": "Engine",
    "unit_price": 405.48,
    "stock_quantity": 104
  },
  {
    "id": 48,
    "oem_code": "BO566124",
    "name": "Door handle",
    "category": "Body",
    "unit_price": 151.24,
    "stock_quantity": 116
  },
  {
    "id": 49,
    "oem_code": "SU560719",
    "name": "Shock absorber",
    "category": "Suspension",
    "unit_price": 121.47,
    "stock_quantity": 0
  },
  {
    "id": 50,
    "oem_code": "BO665207",
    "name": "Bumper",
    "category": "Body",
    "unit_price": 256.61,
    "stock_quantity": 118
  },
  {
    "id": 51,
    "oem_code": "TR674965",
    "name": "Drive shaft",
    "category": "Transmission",
    "unit_price": 268.13,
    "stock_quantity": 36
  },
  {
    "id": 52,
    "oem_code": "SU454129",
    "name": "Wheel bearing",
    "category": "Suspension",
    "unit_price": 222.01,
    "stock_quantity": 57
  },
  {
    "id": 53,
    "oem_code": "EL504767",
    "name": "Headlight bulb",
    "category": "Electrical",
    "unit_price": 66.04,
    "stock_quantity": 6
  },
  {
    "id": 54,
    "oem_code": "EL240592",
    "name": "Headlight bulb",
    "category": "Electrical",
    "unit_price": 336.62,
    "stock_quantity": 0
  },
  {
    "id": 55,
    "oem_code": "TR562649",
    "name": "Clutch kit",
    "category": "Transmission",
    "unit_price": 545.32,
    "stock_quantity": 48
  },
  {
    "id": 56,
    "oem_code": "BR794188",
    "name": "Brake disc",
    "category": "Brakes",
    "unit_price": 163.17,
    "stock_quantity": 30
  },
  {
    "id": 57,
    "oem_code": "EL954991",
    "name": "Headlight bulb",
    "category": "Electrical",
    "unit_price": 143.78,
    "stock_quantity": 101
  },
  {
    "id": 58,
    "oem_code": "SU079431",
    "name": "Coil spring",
    "category": "Suspension",
    "unit_price": 71.94,
    "stock_quantity": 65
  },
  {
    "id": 59,
    "oem_code": "BO108609",
    "name": "Door handle",
    "category": "Body",
    "unit_price": 102.84,
    "stock_quantity": 3
  },
  {
    "id": 60,
    "oem_code": "BO141517",
    "name": "Door handle",
    "category": "Body",
    "unit_price": 244.12,
    "stock_quantity": 70
  },
  {
    "id": 61,
    "oem_code": "EL468829",
    "name": "Starter motor",
    "category": "Electrical",
    "unit_price": 99.85,
    "stock_quantity": 66
  },
  {
    "id": 62,
    "oem_code": "EN733295",
    "name": "Water pump",
    "category": "Engine",
    "unit_price": 246.73,
    "stock_quantity": 72
  },
  {
    "id": 63,
    "oem_code": "SU960157",
    "name": "Control arm",
    "category": "Suspension",
    "unit_price": 53.8,
    "stock_quantity": 102
  },
  {
    "id": 64,
    "oem_code": "BO467903",
    "name": "Door handle",
    "category": "Body",
    "unit_price": 110.89,
    "stock_quantity": 84
  },
  {